课程名,课程编号,课序号,学分,任课教师,上课地点,上课日期,上课时间,课程介绍,起始周,结束周,开课院系
算法设计及其复杂性分析,$04100012$,90,2,雍俊海,???,Tuesday,$2-3$,"本课程目的是落实“学中练，练中学；练中闯，练中创”的指导思想，使学生初步熟悉《算法设计及其复杂性分析》富有挑战的科研方法，经历其过程，要求学生一边自学算法设计及其复杂性分析理论与技术，一边利用现学到的理论与技术对特定的国家“卡脖子”技术基础问题进行攻关，经历啃硬骨头攻关硬核问题的过程，逐步提升在重重困难下的抗压能力、自主研究能力以及分析问题、研究问题、算法设计以及算法分析与验证的能力。这些攻关问题又偏又难又繁琐，工作量也很大。本课程以自学与自主攻关为主，主要依靠学生自学，由学生自己去寻找求解答案，教师只是起到引导的作用。在课堂上，同学之间进行专题研讨，沟通与交流。同学可以自由组成学习研讨小组，尝试展开相关问题的研究工作。最终学生提交问题求解报告以及一些中间过程报告，教师根据问题的解决程度以及求解过程中提出思想的创新性等评定成绩。选课指导：本课程富有挑战性，需要较大的勇气以及强烈的求知欲望和上进心。请想混学分或担心学习力不从心的同学不要选这门课。据往届同学反映，本课程作业量大，富有挑战性，需要付出很大的努力，最终收获也很大。",1,8,软件学院
大数据技术导论,$04100041$,90,1,王建民,???,Thursday,$4-6$,"近年来，“大数据”作为一个新的名词在众多领域得到关注，包括科学、工程、医疗、卫生、经济、商业，乃至整个社会。除了直观理解的“规模大”（Volume）特征以外，大数据还具有“高吞吐率”（Velocity），“多样性”（Variety），“价值稀疏”（Value）等多个V特征。本课程侧重引导学生对大数据管理与应用的学习兴趣和路线。从当前行业现状出发，利用一些真实案例，向学生介绍行业中大数据存在的真实情况，引出一系列大数据所带来的价值与挑战，使得学生对相关背景和存在问题建立初步轮廓。通过介绍大数据相关技术，让学生对大数据管理技术有一个大致了解，从而引导学生对后续相关课程的选则。此外，本课程还将介绍知名大学在大数据研究方面的最新进展，以及潜在的研究方向，激发同学进一步学习研究的热情。",1,8,软件学院
互联网科技创新及其工业应用,$14100012$,90,2,李振华,???,Monday,$1-6$,"互联网深刻影响了当今人类生活的各个层面，其规模巨大、发展迅速，科技创新层出不穷。然而，从互联网科技创新的理论算法技术或系统原型成果，发展到大规模应用部署的工业转化，往往可能经历曲折漫长的过程，甚至永远停留在实验室阶段，这对高校学生群体来说尤为突出。因此，如何理解、评估、控制、改进互联网科技创新成为重要的研究课题和实践内容，在计算机、经济管理、政策法律、职业规划、创业投资等领域受到广泛关注。 本课程侧重讲解互联网科技创新的知识结构及宏观架构，兼顾工程项目管理及政策法规说明，涵盖科技创新成果具体化、生活化、产业化的实用技能，特别是任课教师在多年科研实践中将十余项互联网创新技术快速、坚实、大规模应用到百度、腾讯、小米等国内知名企业的具体案例。课程内容覆盖异构工业环境和多元应用场景，具备很强的参考性。",1,16,软件学院
创意软件,$14100042$,90,2,刘璘,???,Tuesday,$2-6$,"软件作为人类文明的新基因，人类的想象力有多丰富，软件的创作内容就有多广泛。在大模型智能时代，软件的创新与社会经济文化的创新交互融合。互联网上的软件作为各类信息服务的载体，其开发方式、运行形态和服务模式等方面都发生着显著的变化，最主要特征就是通过人和互联网这个生态环境下的软件主体交互协同来更好地满足人类的各方面需求。随着大模型智能技术的应用，在线平台及线上协同工作环境为人类提供的辅助越来越强。本门课程旨在提升学生作为未来设计师的眼界与品位、对软件技术的理解的深度、评价技术可行性和评判系统设计的好坏。",1,8,软件学院
离散数学(1),$24100023$,0,3,刘世霞,???,Friday,$5-2$,"本课程是软件学院的基础数学课程，以离散量为研究对象，即面向计算机科学的应用，同时欲揭示相关理论的内在联系。本课程主要包括以下内容：（1）数理逻辑部分：包括命题及其符号化、命题公式及其真值、命题逻辑等值演算、命题逻辑的推理理论、谓词的概念及其符号化、谓词等值演算，范式以及谓词的推理理论等内容。（2）集合论：包括集合的概念、运算；关系及其表示，关系的性质，等价关系与等价类、相容关系、偏序关系以及格与布尔代数；函数的概念，反函数和复合函数，模糊子集等内容；实数集合与集合的基数、康托定理以及连续统假设等。课程思政方面，本课堂旨在教授学生知识、培养学生能力的同时，注重科学思维方法的训练和科学伦理的教育，培养学生探索未知、勇攀科学高峰的责任感和使命感, 求真务实、追求真理的价值观。",1,16,软件学院
程序设计基础,$34100063$,0,3,刘玉身,???,Tuesday,$2-2$,"通过课堂讲授和上机实践相结合的方式，使学生理解程序设计的基本思路和常用编程思想，掌握编写程序解决实际问题的一般方法，并为将来学习专业领域的其他编程语言打下基础。 课程由简单的计算程序入手，通过不同的问题引出解决问题所需的程序设计思想和方法，依次讲授程序设计中的代数思维、逻辑思维、模块化思维，枚举法、递推法、动态规划及优先搜索算法等，由浅入深。 上机实践过程中，通过分组编程、配对调试等形式，引导学生逐渐形成团队意识，为高年级较大型的课程作业及研究项目打下基础。",1,16,软件学院
程序设计基础,$34100063$,1,3,王继良,???,Tuesday,$2-2$,"通过课堂讲授和上机实践平行课堂相结合的方式，使学生理解程序设计的基本思路和常用编程思想，掌握编写程序解决实际问题的一般方法，并为将来学习专业领域的其他编程语言打下基础。课程由简单的计算程序入手，通过不同的问题引出解决问题所需的程序设计思想和方法，依次讲授程序设计中的代数思维、逻辑思维、模块化思维，枚举法、递推法、动态规划及优先搜索算法等，由浅入深。上机实践过程中，通过分组编程、配对调试等形式，引导学生逐渐形成团队意识，为高年级较大型的课程作业及研究项目打下基础。课程思政方面，本课堂旨在教授学生知识、培养学生能力的同时，引导学生对未来就业的思考，激励学生打好编程基础，用编程来解决实际问题，鼓励学生发散思维、勇于创新和探索。",1,16,软件学院
数据结构,$34100373$,0,3,丁贵广,???,Wednesday,$3-2$,"数据结构是计算机程序设计的重要理论基础，它所讨论的知识内容和提倡的技术方法，无论对进一步学习计算机领域的其它课程，还是对从事软件工程的开发，都有着不可替代的作用。通过本门课程的学习，帮助学生正确理解和掌握数据结构相关的基本概念、基本定理、基本算法及实现方法，了解相关知识在计算机各个领域的重要应用，同时培养学生将实际问题抽象为数学问题并利用相应的数学基本理论分析方法和算法解决问题的能力，使学生学会从问题入手，分析研究计算机处理的数据结构的特性，以便为应用所涉及的数据选择适当的逻辑结构、存储结构及其相应的操作算法，并初步掌握时间和空间分析技术。在理论和实践上都为后续其它计算机专业课程的学习奠定坚实的基础。同时，通过介绍数据结构的发展历史，让同学了解信息领域的核心贡献的科学家分布情况，提高学生为我国信息技术发展贡献力量的民族责任感。",1,16,软件学院
综合论文训练,$44100010$,0,15,王朝坤,???,Sunday,$7-6$,"综合论文训练是本科生按照培养方案达到培养目标的重要环节，也是训练学生解决实际问题的基本能力、培养创新意识和创新能力的综合环节。该环节要求学生在教师指导下综合运用所学知识，完成一项课题研究或相应的综合训练任务，并独立完成一篇论文，作为学生的“学士学位论文”。",1,16,软件学院
计算机网络,$44100113$,0,3,杨铮,???,Wednesday,$3-2$,"介绍计算机网络的概念、原理和体系结构，着重讲述物理层、数据链路层、介质访问子层、网络层、传输层和应用层的基本原理和协议。主要内容包括：计算机网络体系结构的基本概念、原则和典型计算机网络参考模型；数据通信基本原理和技术，通信交换技术；物理层的定义、功能和特性，典型物理层标准接口和传输介质；数据链路层的定义和功能，错误检测和纠正，基本的数据链路层协议。滑动窗口协议，协议说明与验证，常用的数据链路层协议；局域网概述，局域网拓扑结构和传输介质，局域网技术，局域网的IEEE 802系列标准，网桥技术，高速局域网技术；网络层概述，路由算法，拥塞控制算法，网络互连，Internet网络层协议和路由器体系结构；传输服务，传输协议；应用层概述，客户/服务器模型，域名服务，简单网络管理协议SNMP，网络安全，电子邮件，WWW，文件传输协议FTP。",1,16,软件学院
软件工程,$44100203$,0,3,刘璘,???,Thursday,$4-2$,"软件工程是一门涉及软件系统开发与维护的学科，重点讲授如何可靠而有效地研发软件系统、经济地控制开发与维护的成本、更好地满足客户的需求等问题。本课程结合当前软件工程的理论和实践，介绍软件工程的基本概念、技术方法和实践原则，论述当前典型的软件开发过程模型，讨论人员组织与管理、项目规划与变更控制、质量管理、成本估算、配置管理等内容，从初始的需求导出到设计、开发和测试等软件生命周期的各个重要方面，论述需求工程、体系结构设计、用户界面设计、软件设计、软件测试和软件进化等方面的不同软件工程技术，其中重点讨论面向对象技术，介绍组件技术和形式化方法。结合课程实践项目的开发，使学生能够掌握软件项目管理和团队开发的工作方法，建立软件开发的系统化和工程化观念，真正学会运用软件工程的思想和现代技术。",1,16,软件学院
专业课程实践,$44100502$,0,2,王朝坤,???,Tuesday,$2-1$,"课程结合软件工程专业各方向的实际科研和工程项目，让学生综合运用所学知识，参与软件系统的整体规划，独立完成模块的需求分析、概念设计、详细设计、实现、测试、实施、产业化等一个或多个阶段。 1、正确理解工程项目的生命周期； 2、基本掌握软件系统的整体规划方法； 3、基本掌握一个模块的需求调研、需求分析、系统设计方法； 4、基本掌握软件系统的测试与实施常用方法； 5、基本掌握软件系统相关文档的编写技巧； 6、初步了解软件产品化过程。",1,16,软件学院
大数据系统软件,$44100512$,0,2,宋韶旭,???,Tuesday,$2-4$,"《大数据系统软件》是针对软件工程专业学生开设的专业选修课，本课程涵盖与大数据系统相关的软件工程专业知识，从软件的角度，讲解大数据系统的分布式原理与设计，使得学生具备扎实的理论基础。同时，课程以真实的大数据系统软件为载体，通过项目大作业的形式，培养学生对大数据系统的使用能力、开发能力以及实验能力。",1,16,软件学院
物联网导论,$44100532$,0,2,王继良,???,Wednesday,$3-4$,"本课程主要讲授物联网相关知识和应用。包括基础知识和系统实践两个部分，基础知识部分强调物联网基础技术及其原理，系统实践部分强调实际系统的理解和实现。通过该课程的学习，学生能够了解物联网平台的原理和技术，学习如何从硬件到软件和协议搭建基本的物联网平台，为后续工作和科研打下基础。课程注重理论和技术的结合以及实际技术的应用，课上将会探讨物联网相关技术和最新的情况，讨论物联网相关技术发展趋势和应用前景。",1,16,软件学院
机器学习,$44100552$,0,2,龙明盛,???,Monday,$1-4$,"机器学习是一门研究如何让计算机无需显式编程就能有效工作的科学。在过去十年中，机器学习为人们带来了自动驾驶汽车、语音识别、机器翻译、人脸识别、网络搜索、推荐系统及对人类基因组更深入的理解。很多研究者认为机器学习是推进实现人工智能的最佳途径。本课程将系统地讲解机器学习，覆盖基本原理、经典模型、高效算法与应用实践。内容包括：1. 监督学习（线性模型、支持向量机、决策树、Boosting）；2. 无监督学习（聚类、量化、降维、稀疏编码）；3. 强化学习（MDP、蒙特卡洛、时间差分、值函数近似、策略梯度、演员评委模型）；4. 学习理论（PAC学习、泛化界、偏差方差分解）。本课程将通过数学推导和编程实践，帮助学生使用机器学习技术解决数据科学和人工智能中的具体应用问题。",1,16,软件学院
计算机组成原理,$44100573$,0,3,杨铮,???,Monday,$1-2$,"计算机组成原理课程是软件工程专业的本科生专业主修课，重点讲解计算机体系结构的设计与实现，这部分内容是了解计算机如何工作、软件如何运行的核心基础。 本课程内容包括计算机中的信息表示、程序的机器级表示、处理器体系结构、存储器体系结构、程序性能优化等。通过本课程的学习，学生可以理解计算机体系结构的基本概念和设计原则，掌握计算机高可靠、高效运行的基本实现方式和方法，并通过编程实践让同学们熟练掌握计算机程序设计、调试、性能优化等技能。",1,16,软件学院
汇编与编译原理,$44100593$,0,3,王朝坤,???,Tuesday,$2-2$,"作为一门理论和实践并重的课程，本课程将介绍汇编语言的基本构成（指令、伪指令等）和汇编程序设计的基本方法，以及编译程序设计和实现的原理。内容包括汇编语言基础、屏幕与键盘操作、数据操作、高级输入／输出、中断与端口、运算符与指令、PC指令系统、词法分析程序和语法分析程序的自动构造理论、语义分析基础、目标代码运行时的存储组织策略、代码生成和优化等。 通过学习汇编语言程序设计的基本方法与高级语言编译程序的设计原理、完成课程实验，学生应该具有使用汇编语言编写程序的能力，对顺序、分支、循环三大程序结构在汇编语言中的实现方法有较好的掌握，对模块化程序设计技术有进一步的了解，增强价值塑造与能力培养，同时清楚地理解一个编译程序是如何工作的，掌握编译器的基本概念、原理、技术和工具，熟悉编译器实现中的基本算法并会编程实现，掌握通过自动化工具生成词法分析器和语法分析器的基本技能，并培养艰苦奋斗、软件报国情怀。",1,16,软件学院
计算机动画的算法与技术,$44100642$,0,2,徐枫,???,Tuesday,$2-2$,"本课程向学生介绍计算机动画技术及与其相关的算法和技术，包括比较基础的用于表达三维运 动对象的网格相关技术和用于渲染动画的三维相机成像模型，以及针对不同运动对象，不同应 用场景的各种动画技术，主要有：基于物理的动画、人脸动画、骨架动画、空间变形动画、关 键帧动画、基于视频的动画等。",9,16,软件学院
计算机图形学基础,$44100652$,0,2,张慧,???,Tuesday,$2-2$,"本课程旨在介绍计算机图形学的基本概念、理论、方法和系统。讲课内容包括：光栅图形 学、真实感图形学、形体在计算机中的基本表示方法等三大部分，具体包括：概述、光栅扫 描显示系统、图形的扫描转换与区域填充、裁剪、图形变换和投影、消隐、OpenGL、颜色视 觉、光照明模型、阴影和纹理、曲线和曲面、三维实体的表示。通过讲课和实验，既向学生 传授图形学的经典方法和最新成果，也注重培养学生动手实践能力。",1,8,软件学院
模型驱动的软件开发,$44100662$,0,2,姜宇,???,Tuesday,$2-3$,"本课程主要面向软件工程专业高年级本科生。课程覆盖当前模型驱动的软件系统设计理论和 实践。课程将围绕当前软件工程中的模型驱动的研发最新技术进展，详细讲解这些技术如何 被用于辅助开发人员用模型描述系统需求，如功能需求、性能需求等；详细讲解这些技术如 何被用于模型的仿真和验证及代码生成。本课程主要分为两阶段：第一阶段重点讲解如何利 用自动机、数据流、等建模方法，对系统的同步异步通信，层次结构进行建模。第二阶段重 点讲解如何利用模型验证，代码生成技术，对模型进行验证并自动生成系统代码。",1,16,软件学院
大数据系统基础（B）,$64100033$,200,3,王智,???,Tuesday,$2-6$,"大数据是一门交叉学科。本门课程作为大数据方向硕士两门信息类公共基础课之一，与大数据系统基础I课程衔接，重点介绍大数据管理的工具平台、开发环境、基本原理。使得学生熟悉典型大数据工具与平台的特性，掌握大数据处理的基本开发方式，巩固和加深大数据分析的基础知识。 本课程的主要内容包括： 大数据软件栈、虚拟化、系统管理、数据清洗、数据存储、处理框架、内存计算、文档数据、NoSQL/NewSQL数据库、图数据、流数据、分析框架、数据分割、以及一致性。",1,16,软件学院
大规模多媒体信息管理与检索,$74100202$,0,2,丁贵广,???,Wednesday,$3-6$,"本课程以大规模多媒体信息管理和检索作为核心内容，系统地介绍了多媒体数据的表示、云数据存储、分布式计算技术的基本理论和方法，并对多媒体管理和检索的前沿研究方向进行了回顾与展望。具体包括如下内容：概述多媒体数据的表示和多媒体管理和检索技术的基本概念和关键技术；详细介绍图像和音视频的感知特征提取方法、相似性度量方法、基于核的高维索引方法、语义标注方法、个性化推荐方法、并行数据挖掘方法和多媒体信息检索的国际标准等；接下来主要讲述大规模多媒体信息的管理与检索的系统实现技术，包括云数据存储技术、分布式系统中的并行算法设计、搜索引擎体系结构设计等；最后讲述大规模多媒体信息管理与检索技术中较成熟的应用系统和最新研究热点，包括：数字图书馆、图片视频搜索引擎技术、移动多媒体搜索技术和云数据管理技术等。 在以上教学内容的基础上我们还安排了基于云环境的多媒体管理与检索实验，希望以此提高同学们的动手能力并增进他们对所学知识的理解与应用。",1,16,软件学院
服务系统构建与应用,$74108012$,0,2,刘璘,???,Sunday,$7-6$,"软件服务是桥接业务服务与信息服务的基础，是现代服务业创新的使能工具。本门课程是面向工程与管理交叉综合型人才开设的研究生研讨课，主要内容围绕面向服务的架构，业务服务分析方法与工具，服务流程建模、服务集成、组合与管理方面的创新思路与最新实践。旨在回答如何利用软件技术与信息服务有效创建、运营与管理企业业务服务。内容包括：业务理解、服务建模、服务实现、服务部署、服务搜索、服务组合、服务提供、服务监测、服务优化与服务管理。",1,16,软件学院
软件需求工程,$84100102$,0,2,刘璘,???,Wednesday,$3-6$,"软件需求工程的目标是识别现实世界中待解决的问题、可改进的方面、可把握的机会，认知问题的范围，并明确刻画出要通过软件技术有效解决的目标问题，设计出解决方案，并分析和确认方案可行性和有效性。软件需求工程是软件工程专业系列核心课程之一，培养学生的软件问题定义与软件系统需求分析能力。课程主要介绍需求工程过程、需求抽取技术、需求建模与分析方法、需求文档化与验证等内容，结合需求工程案例介绍需求工程方法学。围绕各教学重点介绍本领域的最新研究进展，带领学生实践工业界采用的最新技术、过程、方法和工具。目的是为后续的软件设计、软件测试、软件演化与维护等软件工程活动提供上游输入。课程教学内容具有基础性、实践性和前沿性。",1,16,软件学院
应用密码学,$84100182$,0,2,赵曦滨,???,Monday,$1-6$,"本课程主要讲述公钥密码体制。通过本课程学习可以掌握关键密码技术，例如数字签名，身份认证等。课程的内容包括： 1、密码学概论。（2学时） 2、欧几里得算法。（2学时） 3、数论基础。（4学时） 4、孙子定理；RSA密码体制。（4学时） 5、Hash及对称密钥。（2学时） 6、群、环、域。（2学时） 7、有限域及其性质（4学时） 8、IP安全。（2学时） 9、高级加密标准。（2学时） 10、常用网络安全协议简介。（2学时） 11、大作业基础知识点普及：实时以太网。（6学时）",1,16,软件学院
软件形式化验证,$84100192$,0,2,贺飞,???,Monday,$1-3$,"随着软件系统规模和复杂性的不断增大，传统的非形式化的规格说明及一般的软件测试方法越来越难以满足软件系统的正确性要求。当前国际上普遍从形式化方法寻求解决该问题的途径。本课程主要介绍形式化验证的基本方法及理论，覆盖从系统建模、规约说明到模型检测验证算法等内容。本课程还将结合实际项目和工具讲解形式化验证技术在软件开发中的具体应用。",1,16,软件学院
数据质量,$84100212$,0,2,李振华,???,Tuesday,$2-6$,"人类社会的进化发展已经从信息技术（Information Technology、IT）时代步入数据技术（Data Technology、DT）时代，数据不再被看作企业运营的辅助性支持材料，而被当成企业运营的一种核心产品。数据中的错误、冲突以及非一致性所带来的开销和风险直接影响到企业的生存与繁荣，尤其是近年来互联网的大规模普及进一步加速了错误数据的产生与传播、极其容易造成虚假的分析结论和扭曲的社会影响。因此，如何理解、评估、控制、改进数据质量成为一个重要的研究课题和实践内容，在统计、管理、计算机科学等领域得到广泛关注。本课程侧重数据质量问题的技术层面，兼顾部分管理知识，主要涵盖数据质量的基本概念与行业背景、数据质量评估的一般过程、数据质量控制的科学方法、以及多种环境下的数据质量分析与优化案例。本课程不仅介绍现有的技术与方法，同时也注重探索数据质量研究的一些最新成果。",1,16,软件学院
网络测量与分析技术,$84100232$,0,2,何源,???,Wednesday,$3-1$,"本课程的讲授方式以课堂教学与研讨相结合。通过分享计算机网络领域前沿的科研成果和探讨该领域的开放性科学问题，开拓同学们的研究视野，提升科研素养，为开展计算机网络相关的研究工作奠定扎实基础。 网络测量和分析作为监控、理解和认识网络行为，并进而优化和重新规划网络结构以及改善网络服务质量的重要手段，受到了越来越多的研究人员的关注和网络运维管理人员的重视，网络测量与分析技术成为当前计算机网络领域重要的研究热点之一。本课程讲授网络测量和分析技术的基础知识，网络基础设施和架构测量，网络性能测量分析、网络可靠性、可用性与安全性的测量分析，网络测量分析技术的具体应用，网络测量与分析的最新研究成果等。",1,8,软件学院
